{
  "authority_id": "fixture-renewal-authority",
  "tenant_id": "fixture-tenant",
  "security_domain_id": "pilot-fixture",
  "contract": "PilotRenewalDelegation",
  "contract_version": "0.6.0-draft.1",
  "record_id": "fixture:delegation",
  "revision": 1,
  "issued_at": "2026-09-23T12:13:00Z",
  "correlation_id": "fixture:delegation",
  "owner_principal": "spiffe://fixture.test/owner",
  "automation_principal": "spiffe://fixture.test/renewal-controller",
  "owner_approval_ref": {
    "uri": "urn:kaiba:fixture:owner-approval",
    "digest": "sha256:bbbbbbbbbbbbbbbbbbbbbbbbbbbbbbbbbbbbbbbbbbbbbbbbbbbbbbbbbbbbbbbb"
  },
  "mode": "same_key_unexpired",
  "members": [
    {
      "logical_device_id": "fixture-logical-a",
      "instance_id": "fixture-instance-a",
      "credential_slot": "slot-management",
      "issuer_id": "fixture-pilot-issuer",
      "audience": "fixture-pilot-audience",
      "target": {
        "asset_ref": "fixture-device-a",
        "identity_ref": {
          "uri": "urn:kaiba:fixture:identity-a",
          "digest": "sha256:207554e1d17a88f402020c93f89102058dd1330d1f670ea6d50baa7ca1c9c836"
        },
        "storage_ref": {
          "uri": "urn:kaiba:fixture:storage-a",
          "digest": "sha256:0bfd2b35422979160f8695a84f6174f2e7510dbc4f3749e4c5dabab7e70f33f9"
        }
      },
      "storage_generation": 1,
      "key_generation": 1,
      "spki_digest": "sha256:b2e01dd638a97d6412c7ef5699d6e92bc8cc72281e4ef4108305aef7520326fd",
      "profile": "rpi5-existing-luks-pilot-v1",
      "permissions": [
        "pilot:self:read",
        "pilot:diagnostic-reference:submit"
      ],
      "enrollment_id": "fixture-instance-a",
      "accepted_gaps": [
        "FA-01",
        "FA-02",
        "FA-03",
        "FA-04",
        "FA-05",
        "FA-06",
        "FA-07",
        "FA-08"
      ],
      "qualification_policy_ref": {
        "uri": "urn:kaiba:fixture:qualification-baseline",
        "digest": "sha256:1816b3b87ca9e2b5d7527d27c287f5dccd6bba654fcddfde74a03ffba39e9532"
      },
      "evidence_scope_digest": "sha256:aaaaaaaaaaaaaaaaaaaaaaaaaaaaaaaaaaaaaaaaaaaaaaaaaaaaaaaaaaaaaaaa",
      "max_observation_age_seconds": 3600
    }
  ],
  "activated_at": "2026-09-23T12:13:00Z",
  "expires_at": "2026-10-23T12:13:00Z",
  "max_renewal_seconds": 604800,
  "state": "active",
  "full_qualification": false
}
